{
  "EncryptionKey": "arn:aws:kms:eu-central-1:505755377845:key/58b75958-883a-440c-842c-85af5d33a5bb",
  "FlattenSeparator": ".",
  "Format": "dotenv",
  "Target": "25-secret-dotenv-json-true-true",
  "ResourceType": "SECRET",
  "SopsS3File": {
    "Bucket": "cdk-hnb659fds-assets-505755377845-eu-central-1",
    "Key": "test-secrets/dotenv/encrypted-best-secret.env"
  }
}