{
    "EncryptionKey": "arn:aws:kms:eu-central-1:505755377845:key/58b75958-883a-440c-842c-85af5d33a5bb",
    "Format": "binary",
    "Target": "01-parameter-binary-binary-true-true",
    "ResourceType": "PARAMETER",
    "SopsS3File": {
      "Bucket": "cdk-hnb659fds-assets-505755377845-eu-central-1",
      "Key": "test-secrets/binary/sopsfile.enc-age.binary"
    },
    "ServiceToken": "arn:aws:lambda:eu-central-1:505755377845:function:SecretsManagerResourceHandler"
  }